timestamp,question,answer
2023-12-06 22:37:46,Explain at least three functions that lipids serve in,"  Of course! Based on the provided context, here are at least three functions that lipids serve in living organisms:
1. Energy storage: Lipids are used to store energy in the form of fats, which can be used by cells for long-term energy needs. This is particularly important for plants and animals that live in environments where food is scarce. When lipids are broken down through metabolic processes, they release fatty acids that can be used as a source of energy.
2. Insurance: Lipids also provide insulation from the environment for plants and animals. This is particularly important for aquatic organisms, such as fish and mammals, which need to keep their bodies dry to prevent water loss. The hydrophobic nature of lipids makes them effective at repelling water, providing a protective barrier against external factors.
3. Hormone synthesis: Lipids are the building blocks of many hormones in living organisms. Hormones are chemical messengers that help regulate various physiological processes, including growth and development, metabolism, and reproductive functions. Lipids are used to create structures that can transmit signals between cells, allowing for efficient communication within the body.
These are just a few examples of the important roles that lipids play in living organisms. With their diverse range of functions and structural properties, it's no wonder that lipids are an essential component of life!"
2023-12-06 22:42:10,plants and/or animal,"  Great! Based on the context you provided, I can answer your questions. Here are three functions of lipids in living organisms:
1. Energy storage: Lipids serve as a source of energy for cells through their hydrophobic nature, which allows them to store energy in the form of fats. When these fats are broken down through metabolic processes, they release fatty acids that can be used as a source of energy.
2. Insurance: Lipids provide insulation from the environment for plants and animals, particularly for aquatic organisms that need to keep their bodies dry to prevent water loss. The hydrophobic nature of lipids makes them effective at repelling water, providing a protective barrier against external factors.
3. Hormone synthesis: Lipids are used as the building blocks of many hormones in living organisms. Hormones are chemical messengers that help regulate various physiological processes, including growth and development, metabolism, and reproductive functions. The structural properties of lipids allow them to create structures that can transmit signals between cells, allowing for efficient communication within the body.
These are just a few examples of the important roles that lipids play in living organisms. As you mentioned, lipids also have various sub-disciplines in biology, including lipidology, microbiology, and human physiology, which study the structure, function, and role of lipids in different contexts."
2023-12-06 22:47:11,Why can some insects walk on water?,"  Great! Based on the context you provided, I can answer your question. Insects can walk on water because of the hydrophobic nature of their exoskeletons. The molecular structure of the exoskeleton repels water, allowing the insect to float on the surface of the water without sinking. This is particularly useful for insects that live in aquatic environments, as it allows them to move freely and easily without having to worry about sinking or struggling in the water."
2023-12-06 22:55:48,Can they still swim?,"  Of course! Based on the context you provided, here are answers to your questions:
User: Can they still swim?
AI: Yes, insects can still swim even though their exoskeletons are hydrophobic. While their exoskeletons repel water, the insect's body is not completely surrounded by water. As a result, they can move their legs and other body parts to propel themselves through the water. Additionally, some insects have adapted to swimming by developing specific structures, such as fins or swimming glands, that help them move more efficiently in water. So while their exoskeletons may not allow them to sink completely, they can still swim and maneuver in the water with some degree of agility."
2023-12-06 23:07:26,Phospholipids are important components of what?,"  Great, thank you for asking! Phospholipids are important components of the plasma membrane of cells. The plasma membrane is a thin layer of lipid and protein molecules that surrounds every cell and separates the cell from its external environment. Phospholipids make up the majority of this membrane, and they play a crucial role in regulating what enters and leaves the cell. They also help maintain the cell's internal balance of fluids and ions. Additionally, phospholipids are important for cell signaling and communication, as well as the transport of nutrients and waste products across the membrane."
2023-12-07 02:43:27,explain carbon bonding?,"  Of course! Carbon is an essential element in living organisms, and its unique bonding properties make it a fundamental component of many biological molecules.
Carbon atoms contain four electrons in their outer shell, which allows them to form four covalent bonds with other atoms or molecules. The simplest organic carbon molecule is methane (CH4), in which four hydrogen atoms bond to a carbon atom (Figure 2.13). This structure is repeated in more complex molecules, such as proteins, carbohydrates, and fats, which are made up of long chains of carbon atoms bonded together with hydrogen atoms.
Carbon can form covalent bonds with other elements, including hydrogen, oxygen, nitrogen, and sulfur. These bonds are strong and stable, allowing carbon to play a central role in the structure and function of biological molecules. In addition to forming covalent bonds, carbon atoms can also form ionic bonds with other elements, such as sodium and chlorine, to produce compounds like table salt (NaCl).
Overall, carbon bonding is essential for the structure and function of living organisms, and its unique properties make it a fundamental element in the chemistry of life."
